<Defs xmlns:xsi="http://www.w3.org/2001/XMLSchema-instance" xsi:noNamespaceSchemaLocation="https://raw.githubusercontent.com/Tachyonite/Pawnmorpher/dev/Schemas/ThoughtDef.xsd">
	<ThoughtDef ParentName="OutlookMemoryBase">
        <durationDays>1</durationDays>
        <defName>PMI_ScorpionTailMemory</defName>
        <stages>
            <li>
                <label>Scorpion Tail</label>
                <description>This thing is so unwieldy</description>
                <visible>true</visible>
                <baseMoodEffect>-1</baseMoodEffect>
            </li>
            <li>
                <label>Scorpion Tail</label>
                <description>No one will mess with me now!</description>
                <visible>true</visible>
                <baseMoodEffect>2</baseMoodEffect>
            </li>
            <li>
                <label>Scorpion Tail</label>
                <description>It's so dangerous and hard to control. Get it off!</description>
                <visible>true</visible>
                <baseMoodEffect>-3</baseMoodEffect>
            </li>
        </stages>
    </ThoughtDef>
</Defs>